<?xml version="1.0" encoding="UTF-8"?>
<p:historical_audit_log_parser_v1
	xmlns:p="historical_audit_log_parser_v1"
	xmlns:xsi="http://www.w3.org/2001/XMLSchema-instance"
	xsi:schemaLocation="historical_audit_log_parser_v1 ../../../../../adapter-lib/src/main/resources/schemas/manager/historical_audit_log_parser_v1.xsd"
	log_type_id="3">
	<p:target_table>hist.audit_commands</p:target_table>
	<p:table_space>tbs_controltrafico_hist</p:table_space>
	<p:field_log_subtype_id>log_subtype_id</p:field_log_subtype_id>
	<p:fields>
		<p:field name="command_type" indexed="true">
				<p:log_type_param_id>1</p:log_type_param_id>
		</p:field>
		<p:field name="element" indexed="true">
				<p:log_type_param_id>2</p:log_type_param_id>
		</p:field>
		<p:field name="command_values">
				<p:log_type_param_id>3</p:log_type_param_id>
		</p:field>
		<p:field name="comment">
				<p:log_type_param_id>4</p:log_type_param_id>
		</p:field>
	</p:fields>
</p:historical_audit_log_parser_v1>
